{
  "$schema": "https://json-schema.org/draft/2020-12/schema",
  "$id": "https://ghost.local/ops/build-tracker/project-tracker.schema.json",
  "title": "Ghost Build Tracker Contract",
  "type": "object",
  "additionalProperties": false,
  "required": [
    "project",
    "worker_positions",
    "phases"
  ],
  "properties": {
    "project": {
      "$ref": "#/$defs/project"
    },
    "core_framing": {
      "$ref": "#/$defs/coreFraming"
    },
    "worker_positions": {
      "$ref": "#/$defs/workerPositions"
    },
    "phases": {
      "type": "array",
      "minItems": 1,
      "items": {
        "$ref": "#/$defs/phase"
      }
    },
    "recent_activity": {
      "type": "array",
      "items": {
        "$ref": "#/$defs/recentActivity"
      }
    }
  },
  "$defs": {
    "timestampUtc": {
      "type": "string",
      "pattern": "^\\d{4}-\\d{2}-\\d{2}T\\d{2}:\\d{2}:\\d{2}Z$"
    },
    "entityId": {
      "type": "string",
      "pattern": "^[a-z0-9][a-z0-9-]*$"
    },
    "stepStatus": {
      "type": "string",
      "enum": [
        "complete",
        "active",
        "pending",
        "blocked",
        "frozen"
      ]
    },
    "workerStatus": {
      "type": "string",
      "enum": [
        "working",
        "blocked",
        "waiting",
        "review",
        "done"
      ]
    },
    "workerPositionStatus": {
      "type": "string",
      "enum": [
        "assigned",
        "available",
        "pending_assignment",
        "standby",
        "blocked",
        "completed",
        "unavailable"
      ]
    },
    "project": {
      "type": "object",
      "additionalProperties": false,
      "required": [
        "name",
        "schema_version",
        "last_updated",
        "current_focus"
      ],
      "properties": {
        "name": {
          "type": "string",
          "minLength": 1
        },
        "schema_version": {
          "type": "string",
          "enum": [
            "1.0"
          ]
        },
        "last_updated": {
          "$ref": "#/$defs/timestampUtc"
        },
        "current_focus": {
          "type": "string",
          "minLength": 1
        }
      }
    },
    "coreFraming": {
      "type": "object",
      "additionalProperties": false,
      "required": [
        "title",
        "principles",
        "openclaw_alignment",
        "rollout_order",
        "canonical_worker_registry"
      ],
      "properties": {
        "title": {
          "type": "string",
          "minLength": 1
        },
        "principles": {
          "type": "array",
          "minItems": 1,
          "items": {
            "type": "string",
            "minLength": 1
          }
        },
        "openclaw_alignment": {
          "type": "array",
          "minItems": 1,
          "items": {
            "type": "string",
            "minLength": 1
          }
        },
        "rollout_order": {
          "type": "array",
          "minItems": 1,
          "items": {
            "type": "string",
            "minLength": 1
          }
        },
        "canonical_worker_registry": {
          "type": "array",
          "minItems": 7,
          "maxItems": 7,
          "uniqueItems": true,
          "items": {
            "type": "string",
            "enum": [
              "Ghost Main",
              "Forge",
              "Probe",
              "Rector",
              "Archivist",
              "Operator",
              "Scout"
            ]
          }
        }
      }
    },
    "workerPositionEntry": {
      "type": "object",
      "additionalProperties": false,
      "required": [
        "name",
        "lane",
        "status",
        "summary",
        "updated_at"
      ],
      "properties": {
        "name": {
          "type": "string",
          "minLength": 1
        },
        "lane": {
          "type": "string",
          "minLength": 1
        },
        "status": {
          "$ref": "#/$defs/workerPositionStatus"
        },
        "assigned_phase_id": {
          "$ref": "#/$defs/entityId"
        },
        "assigned_step_id": {
          "$ref": "#/$defs/entityId"
        },
        "summary": {
          "type": "string",
          "minLength": 1
        },
        "task_title": {
          "type": "string",
          "minLength": 1
        },
        "note": {
          "type": "string",
          "minLength": 1
        },
        "branch": {
          "type": "string",
          "minLength": 1
        },
        "blocking_on": {
          "type": "string",
          "minLength": 1
        },
        "updated_at": {
          "$ref": "#/$defs/timestampUtc"
        }
      }
    },
    "canonicalWorkerPositionEntry": {
      "allOf": [
        {
          "$ref": "#/$defs/workerPositionEntry"
        },
        {
          "type": "object",
          "properties": {
            "name": {
              "type": "string",
              "enum": [
                "Ghost Main",
                "Forge",
                "Probe",
                "Rector",
                "Archivist",
                "Operator",
                "Scout"
              ]
            }
          }
        }
      ]
    },
    "workerPositions": {
      "type": "object",
      "additionalProperties": false,
      "required": [
        "canonical_runtime_workers",
        "external_implementation_workers"
      ],
      "properties": {
        "canonical_runtime_workers": {
          "type": "array",
          "minItems": 7,
          "maxItems": 7,
          "items": {
            "$ref": "#/$defs/canonicalWorkerPositionEntry"
          }
        },
        "external_implementation_workers": {
          "type": "array",
          "items": {
            "$ref": "#/$defs/workerPositionEntry"
          }
        }
      }
    },
    "workerMarker": {
      "type": "object",
      "additionalProperties": false,
      "required": [
        "name",
        "status",
        "task"
      ],
      "properties": {
        "name": {
          "type": "string",
          "minLength": 1
        },
        "status": {
          "$ref": "#/$defs/workerStatus"
        },
        "task": {
          "type": "string",
          "minLength": 1
        },
        "task_title": {
          "type": "string",
          "minLength": 1
        },
        "branch": {
          "type": "string",
          "minLength": 1
        },
        "updated_at": {
          "$ref": "#/$defs/timestampUtc"
        }
      }
    },
    "substep": {
      "type": "object",
      "additionalProperties": false,
      "required": [
        "id",
        "title",
        "status",
        "active_workers"
      ],
      "properties": {
        "id": {
          "$ref": "#/$defs/entityId"
        },
        "title": {
          "type": "string",
          "minLength": 1
        },
        "detail": {
          "type": "string"
        },
        "status": {
          "$ref": "#/$defs/stepStatus"
        },
        "active_workers": {
          "type": "array",
          "items": {
            "$ref": "#/$defs/workerMarker"
          }
        }
      }
    },
    "step": {
      "type": "object",
      "additionalProperties": false,
      "required": [
        "id",
        "title",
        "status",
        "active_workers"
      ],
      "properties": {
        "id": {
          "$ref": "#/$defs/entityId"
        },
        "title": {
          "type": "string",
          "minLength": 1
        },
        "detail": {
          "type": "string"
        },
        "status": {
          "$ref": "#/$defs/stepStatus"
        },
        "active_workers": {
          "type": "array",
          "items": {
            "$ref": "#/$defs/workerMarker"
          }
        },
        "substeps": {
          "type": "array",
          "items": {
            "$ref": "#/$defs/substep"
          }
        }
      }
    },
    "phase": {
      "type": "object",
      "additionalProperties": false,
      "required": [
        "id",
        "title",
        "status",
        "steps"
      ],
      "properties": {
        "id": {
          "$ref": "#/$defs/entityId"
        },
        "title": {
          "type": "string",
          "minLength": 1
        },
        "summary": {
          "type": "string",
          "minLength": 1
        },
        "status": {
          "$ref": "#/$defs/stepStatus"
        },
        "steps": {
          "type": "array",
          "minItems": 1,
          "items": {
            "$ref": "#/$defs/step"
          }
        }
      }
    },
    "recentActivity": {
      "type": "object",
      "additionalProperties": false,
      "required": [
        "time",
        "worker",
        "status",
        "step_id",
        "note"
      ],
      "properties": {
        "time": {
          "$ref": "#/$defs/timestampUtc"
        },
        "worker": {
          "type": "string",
          "minLength": 1
        },
        "status": {
          "$ref": "#/$defs/workerStatus"
        },
        "step_id": {
          "$ref": "#/$defs/entityId"
        },
        "note": {
          "type": "string",
          "minLength": 1
        },
        "task_title": {
          "type": "string",
          "minLength": 1
        }
      }
    }
  }
}
