{
  "project": {
    "name": "Ghost Build Tracker",
    "schema_version": "1.0",
    "last_updated": "2026-03-15T01:26:02Z",
    "current_focus": "Architecture-sensitive queue: 2E migration strategy; 3C-ii/3E/3E-ii/3F runtime load; 7C-ii/7C-iii/7D-ii followthrough reliability"
  },
  "core_framing": {
    "title": "Core framing / governing principles",
    "principles": [
      "Ghost is a general orchestrator and governed capability platform, not a hardcoded assistant with fixed roles.",
      "One pinned conversation owner stays responsible per thread.",
      "Workers are used only through explicit delegation.",
      "Every delegation becomes a visible task/work item.",
      "Capabilities are preferred over raw tools.",
      "Shared context and source-of-truth discipline outrank flashy autonomy.",
      "MVP target is the end of Phase 7.",
      "Phase 8 is post-MVP and does not replace MVP closure.",
      "The canonical 10-phase spine remains stable while subphases stay flexible.",
      "Home Assistant remains the control boundary for the Home domain."
    ],
    "openclaw_alignment": [
      "One pinned conversation owner per thread.",
      "Workers are only invoked through explicit delegation.",
      "No silent model/provider switching inside a single user conversation.",
      "Every delegation creates a visible task/work item.",
      "Worker sessions remain separate from the parent conversation."
    ],
    "rollout_order": [
      "Build",
      "Study",
      "Finance",
      "Home"
    ],
    "canonical_worker_registry": [
      "Ghost Main",
      "Forge",
      "Probe",
      "Rector",
      "Archivist",
      "Operator",
      "Scout"
    ]
  },
  "worker_positions": {
    "canonical_runtime_workers": [
      {
        "name": "Ghost Main",
        "lane": "governed-ownership",
        "status": "available",
        "summary": "Tracked as canonical runtime owner; no active runtime assignment asserted in this side tracker pass.",
        "updated_at": "2026-03-15T01:25:00Z"
      },
      {
        "name": "Forge",
        "lane": "specialist-worker",
        "status": "standby",
        "summary": "No active roadmap assignment in this tracker pass.",
        "updated_at": "2026-03-15T01:25:00Z"
      },
      {
        "name": "Probe",
        "lane": "specialist-worker",
        "status": "standby",
        "summary": "No active roadmap assignment in this tracker pass.",
        "updated_at": "2026-03-15T01:25:00Z"
      },
      {
        "name": "Rector",
        "lane": "specialist-worker",
        "status": "standby",
        "summary": "No active roadmap assignment in this tracker pass.",
        "updated_at": "2026-03-15T01:25:00Z"
      },
      {
        "name": "Archivist",
        "lane": "specialist-worker",
        "status": "standby",
        "summary": "No active roadmap assignment in this tracker pass.",
        "updated_at": "2026-03-15T01:25:00Z"
      },
      {
        "name": "Operator",
        "lane": "runtime-operator",
        "status": "available",
        "summary": "Canonical runtime worker tracked with neutral availability in side tracker state.",
        "updated_at": "2026-03-15T01:25:00Z"
      },
      {
        "name": "Scout",
        "lane": "specialist-worker",
        "status": "standby",
        "summary": "No active roadmap assignment asserted in this tracker pass.",
        "updated_at": "2026-03-15T01:25:00Z"
      }
    ],
    "external_implementation_workers": [
      {
        "name": "Copilot",
        "lane": "tracker-lane",
        "status": "available",
        "summary": "Tracker lane pass completed; available for next assignment.",
        "updated_at": "2026-03-15T01:25:00Z"
      },
      {
        "name": "Claude",
        "lane": "implementation",
        "status": "assigned",
        "summary": "TASK-002 started — src/runtime scaffold + classifier/config + test infrastructure",
        "updated_at": "2026-03-15T01:26:02Z",
        "assigned_phase_id": "phase-3",
        "assigned_step_id": "p3e-ii-extract-business-logic-to-source-files",
        "note": "Conducting full repo/runtime reality reconciliation against v3 canonical docs",
        "branch": "phase3/3E-scaffold"
      },
      {
        "name": "Codex",
        "lane": "implementation",
        "status": "standby",
        "summary": "Standby for assignment; no active implementation step started in this tracker state.",
        "updated_at": "2026-03-15T01:25:00Z"
      }
    ]
  },
  "phases": [
    {
      "id": "phase-1",
      "title": "Phase 1 — Foundation Lab",
      "summary": "Foundation lab baseline remains established across compute/runtime benching, early service bring-up, and first toy workflow loops.",
      "status": "complete",
      "steps": [
        {
          "id": "p1a-compute-runtime-bench",
          "title": "1A Compute and runtime bench",
          "detail": "Initial local compute/runtime benching patterns are established and reusable.",
          "status": "complete",
          "active_workers": []
        },
        {
          "id": "p1b-core-services-bootstrapping",
          "title": "1B Core services bootstrapping",
          "detail": "Core services bootstrapping flow is established for repeatable local bring-up.",
          "status": "complete",
          "active_workers": []
        },
        {
          "id": "p1c-initial-model-strategy",
          "title": "1C Initial model strategy",
          "detail": "Initial model strategy direction was established for early routing and fallback behavior.",
          "status": "complete",
          "active_workers": []
        },
        {
          "id": "p1d-repo-workspace-discipline",
          "title": "1D Repo and workspace discipline",
          "detail": "Repository and workspace discipline conventions are in place for operator-safe execution.",
          "status": "complete",
          "active_workers": []
        },
        {
          "id": "p1e-first-end-to-end-toy-workflow",
          "title": "1E First end-to-end toy workflow",
          "detail": "First end-to-end toy workflow path was proven to validate core control flow.",
          "status": "complete",
          "active_workers": []
        }
      ]
    },
    {
      "id": "phase-2",
      "title": "Phase 2 — Core System of Record and Service Topology",
      "summary": "Phase 2 remains established, while 2E schema migration strategy is explicitly tracked as an active load-bearing architectural lane.",
      "status": "complete",
      "steps": [
        {
          "id": "p2a-authoritative-architecture-shape",
          "title": "2A Authoritative architecture shape",
          "detail": "Authoritative architecture shape for core services and execution flow is established.",
          "status": "complete",
          "active_workers": []
        },
        {
          "id": "p2b-database-split-persistence-model",
          "title": "2B Database split and persistence model",
          "detail": "Database split and persistence model patterns are largely established.",
          "status": "complete",
          "active_workers": []
        },
        {
          "id": "p2c-environment-deployment-layout",
          "title": "2C Environment and deployment layout",
          "detail": "Environment and deployment layout conventions are established for controlled operations.",
          "status": "complete",
          "active_workers": []
        },
        {
          "id": "p2d-reliability-groundwork",
          "title": "2D Reliability groundwork",
          "detail": "Reliability groundwork for baseline operations is largely in place.",
          "status": "complete",
          "active_workers": []
        },
        {
          "id": "p2e-schema-migration-strategy",
          "title": "2E Schema Migration Strategy",
          "detail": "Migration sequencing, safety envelopes, and reversibility contracts are tracked as active architectural pressure without claiming implementation completion.",
          "status": "active",
          "active_workers": []
        }
      ]
    },
    {
      "id": "phase-3",
      "title": "Phase 3 — Orchestration Core and Runtime Discipline",
      "summary": "Phase 3 is substantially complete, but v3.0 reopens major architectural load-bearing work around async delegation, circuit breaking, runtime decomposition, source extraction, and Redis activation.",
      "status": "active",
      "steps": [
        {
          "id": "p3a-conversation-ownership-model",
          "title": "3A Conversation ownership model",
          "detail": "Pinned conversation ownership model is established as a core orchestration rule.",
          "status": "complete",
          "active_workers": []
        },
        {
          "id": "p3b-explicit-delegation-model",
          "title": "3B Explicit delegation model",
          "detail": "Explicit delegation model remains active and is now expanded for asynchronous delegation pathways.",
          "status": "active",
          "active_workers": [],
          "substeps": [
            {
              "id": "p3b-ii-asynchronous-delegation-via-message-bus",
              "title": "3B-ii Asynchronous Delegation via Message Bus",
              "detail": "Message-bus delegation contracts are tracked as active architecture work and are not marked complete.",
              "status": "active",
              "active_workers": []
            }
          ]
        },
        {
          "id": "p3c-worker-identity-routing",
          "title": "3C Worker identity and routing",
          "detail": "Worker identity and routing contracts are established, with v3.0 hardening focused on failure control paths.",
          "status": "active",
          "active_workers": [],
          "substeps": [
            {
              "id": "p3c-ii-circuit-breaker-for-model-routing",
              "title": "3C-ii Circuit Breaker for Model Routing",